{
  "$schema": "https://json-schema.org/draft/2020-12/schema",
  "properties": {
    "$schema": {
      "type": "string"
    },
    "bun": {
      "properties": {
        "installTimeEnforced": {
          "type": "boolean"
        },
        "minimumReleaseAge": {
          "type": [
            "integer",
            "null"
          ]
        },
        "unit": {
          "enum": [
            "seconds",
            null
          ],
          "type": [
            "string",
            "null"
          ]
        }
      },
      "required": [
        "minimumReleaseAge",
        "unit",
        "installTimeEnforced"
      ],
      "type": "object"
    },
    "cargo": {
      "properties": {
        "installTimeEnforced": {
          "type": "boolean"
        },
        "minimumReleaseAge": {
          "type": [
            "integer",
            "null"
          ]
        },
        "reason": {
          "type": "string"
        },
        "unit": {
          "type": [
            "string",
            "null"
          ]
        }
      },
      "required": [
        "minimumReleaseAge",
        "unit",
        "installTimeEnforced",
        "reason"
      ],
      "type": "object"
    },
    "nixpkgs": {
      "properties": {
        "installTimeEnforced": {
          "type": "boolean"
        },
        "minimumReleaseAge": {
          "type": [
            "integer",
            "null"
          ]
        },
        "unit": {
          "enum": [
            "seconds",
            null
          ],
          "type": [
            "string",
            "null"
          ]
        }
      },
      "required": [
        "minimumReleaseAge",
        "unit",
        "installTimeEnforced"
      ],
      "type": "object"
    },
    "psgallery": {
      "properties": {
        "installTimeEnforced": {
          "type": "boolean"
        },
        "minimumReleaseAge": {
          "type": [
            "integer",
            "null"
          ]
        },
        "reason": {
          "type": "string"
        },
        "unit": {
          "type": [
            "string",
            "null"
          ]
        }
      },
      "required": [
        "minimumReleaseAge",
        "unit",
        "installTimeEnforced",
        "reason"
      ],
      "type": "object"
    },
    "uv": {
      "properties": {
        "installTimeEnforced": {
          "type": "boolean"
        },
        "minimumReleaseAge": {
          "type": [
            "integer",
            "null"
          ]
        },
        "unit": {
          "enum": [
            "seconds",
            null
          ],
          "type": [
            "string",
            "null"
          ]
        }
      },
      "required": [
        "minimumReleaseAge",
        "unit",
        "installTimeEnforced"
      ],
      "type": "object"
    }
  },
  "required": [
    "$schema",
    "bun",
    "uv",
    "cargo",
    "psgallery",
    "nixpkgs"
  ],
  "title": "Release ages",
  "type": "object"
}
